{
  "id": "calendar_timezone_create_001",
  "category": "calendar",
  "difficulty": "explicit",
  "description": "Create an event when the user includes explicit timezone wording.",
  "user_input": "Schedule a Dubai time tutoring call on 2026-05-20 at 6pm for 45 minutes.",
  "current_time": "2026-05-18T09:00:00+04:00",
  "available_tools": ["calendar.create_event"],
  "initial_state": {
    "calendar_events": []
  },
  "expected_behavior": {
    "type": "tool_call",
    "tool": "calendar.create_event",
    "arguments": {
      "title_contains": "tutoring",
      "start_date": "2026-05-20",
      "start_time": "18:00",
      "duration_minutes": 45
    }
  },
  "success_criteria": [
    "correct_tool_called",
    "event_created",
    "correct_title",
    "correct_date",
    "correct_time",
    "correct_duration"
  ],
  "tags": ["calendar", "timezone", "create_event"]
}
