{
  "id": "notion_contextual_complete_001",
  "category": "notion",
  "difficulty": "contextual",
  "description": "Complete an existing Notion task identified from initial state.",
  "user_input": "Mark my physics lab report task as done.",
  "current_time": "2026-05-18T09:00:00Z",
  "available_tools": ["notion.update_task"],
  "initial_state": {
    "notion_tasks": [
      {
        "id": "task_physics_lab_001",
        "title": "Finish physics lab report",
        "status": "open",
        "due_date": "2026-05-22"
      }
    ]
  },
  "expected_behavior": {
    "type": "tool_call",
    "tool": "notion.update_task",
    "arguments": {
      "task_id": "task_physics_lab_001",
      "status": "done"
    }
  },
  "success_criteria": [
    "correct_tool_called",
    "correct_task_selected",
    "correct_status",
    "task_updated"
  ],
  "tags": ["notion", "contextual", "complete_task", "single_tool"]
}
